title,company_name,has_company_name,salary,has_salary,url,source,description,label,id
Снабженец,ТОО Opt Building Group,1,"от 400 000 до 500 000 ₸ за месяц, на руки",1,https://almaty.hh.kz/vacancy/132180030?hhtmFrom=vacancy_search_list,hh.kz,"обязанности: контроль отгрузок на объекты согласно графика поставок поиск транспорта для отгрузок участие в отгрузках непосредственно на объектах (стройплощадки) передача клиентам товара по количеству и качеству работа с браком складской запас, склад работа по поиску новых заводов, переговоры организация бесперебойной работы отдела составление заявок на заводы проверка спецификаций требования: опыт работы на аналогичной должности обязателен внимательность, грамотность, исполнительность, умение управлять коллективом. умение работать со всей соответствующей документацией. условия: график работы 5/2 оформление согласно законодательства рк",,278
"Продавец-консультант в магазин ""Nike"" (Mega)",ТОО Delta Sport (Казахстан),1,от 320 000 ₸ за месяц на руки,1,https://almaty.hh.kz/vacancy/132069898?hhtmFrom=vacancy_search_list,hh.kz,,,69
Ищем парикмахера,,0,,0,https://www.olx.kz/obyavlenie/rabota/ischem-parikmahera-IDqpFZ8.html,olx.kz,,,542
Продавец в Зоомагазин,ИП Бельский А.А.,1,от 200 000 до 400 000 ₸ за месяц на руки,1,https://almaty.hh.kz/vacancy/131921187?hhtmFrom=vacancy_search_list,hh.kz,обязанности: консультировать покупателей продавать товар принимать товар выкладывать на витрины формировать заявки поддерживать порядок и чистоту в помещении требования: знание компьютера ответственность коммуникабельность вежливость условия: без опыта - стажировка 1 месяц,,189
Юрист,ТОО Realprom,1,"от 400 000 до 500 000 ₸ за месяц, до вычета налогов",1,https://almaty.hh.kz/vacancy/132200345?hhtmFrom=vacancy_search_list,hh.kz,"обязанности: полное юридическое сопровождение производственной деятельности организации; юридическое сопровождение процесса строительства требования: опыт работы юристом в строительной компании не менее 3-х лет; отличное знание договорного права, наличие обширного опыта составления и правовой экспертизы различных видов договоров (поставка тмц (в т.ч. вэд контракты), подряд, услуги, аренда техники и т.п.); отличное знание гражданского кодекса, нпа, регламентирующих строительство промышленных объектов, таможенного законодательства, законодательства о разрешениях и уведомлениях, трудового законодательства; опыт претензионной и судебной работы, представления интересов во всех судебных инстанциях; опыт участия в закупках/тендерах. условия: официальное трудоустройство и официальная заработная плата; график работы: 5-ти дневная рабочая неделя, с 8 до 17, обед с 12 до 13; своевременная выплата заработной платы; полное и своевременное отчисление пенсионных, социальных и иных выплат, предусмотренных законодательством; размер заработной платы определяется по договоренности сторон, в зависимости от уровня профессионализма и компетентности кандидата.",,272
Требуется техничка,,0,1 500 тг.,1,https://www.olx.kz/obyavlenie/rabota/trebuetsya-tehnichka-IDqMfNH.html,olx.kz,,,634
Работа вахтой на складах в Москве( Россия),,0,,0,https://www.olx.kz/obyavlenie/rabota/rabota-vahtoy-na-skladah-v-moskve-rossiya-IDqbUAG.html,olx.kz,,,533
Администратор,ТОО KZBURO,1,"от 200 000 до 1 000 000 ₸ за месяц, на руки",1,https://almaty.hh.kz/vacancy/131674046?hhtmFrom=vacancy_search_list,hh.kz,"мы ищем людей, которые не хотят жить в режиме постоянных рассрочек и кредитов вроде «0/0/12» и вечного kaspi red кто нацелен на уровень жизни выше среднего и готов за него реально бороться кто готов взять ответственность за свои результаты и перестать плыть по течению ⚠️ важно: здесь нет фиксированного оклада это не про работу «за копейки по инструкции» это про доход, который напрямую зависит от твоих действий что нужно делать: общаться с компаниями, объяснять им требования по обязательному обучению и помогать оформлять документы процесс несложный — всему обучим с нуля 💰 что ты получаешь: 50% с каждой сделки без потолка по доходу реальный заработок — до 50 000 тенге в день (чистыми) опыт не требуется — всему научим график: 5/2 время работы: с 09:00 до 17:00 формат: офис (г. алматы, ул. жандосова 1/1) выплаты: один раз в месяц 📲 хочешь реально изменить свою жизнь? оставляй отклик. и если ты дочитал до конца осознанно, а не отправляешь отклики всем подряд — напиши в сопроводительном сообщении: «я достоин(а) большего» остальному научим, поддержим и покажем, как выйти на достойный доход",,237
Специалист по маркетингу и рекламе,Hyundai Premium Batys,1,,0,https://almaty.hh.kz/vacancy/131699844?hhtmFrom=vacancy_search_list,hh.kz,"обязанности: - ведение рекламных кампаний, подготовка и размещение рекламных материалов в социальных сетях; - привлечение целевой аудитории, увеличение количества посетителей, подписчиков, участников групп; - создание и размещение фото и видео-контента в публикациях и stories; - организация и проведение конкурсов, опросов, акций; - коммуникация с аудиторией, ответы на вопросы, комментарии; - анализ эффективности рекламных кампаний, smm-продвижения; - составление контент-планов; - разрабатывать и/или делать ресайзы макетов, текстов, креативов по поручению руководства для социальных сетей, сайтов, лендингов, led-ов, наружной рекламы статичной и динамичной, радио, и пр. каналов размещения; - запуск и контроль таргетированной рекламы; требования: - опыт работы в smm от 1-3 лет; - навыки фото и видеосъемки; - продвинутый пользователь программ и приложений для редактирования фотографий и видео; - грамотная письменная и устная речь; - основы копирайтинга и веб-райтинга; - опыт работы с coreldraw, photoshop, tilda, canva, trello; условия: медицинское обслуживание скидки на спортивно-оздоровительные услуги материальная помощь скидки на услуги автосервиса",,89
Требуется уборщица в баню,,0,70 000 тг.,1,https://www.olx.kz/obyavlenie/rabota/trebuetsya-uborschitsa-v-banyu-IDqE3zC.html,olx.kz,,,753
Backend-разработчик (Python),ТОО Аврора Сервис,1,,0,https://almaty.hh.kz/vacancy/132068300?hhtmFrom=vacancy_search_list,hh.kz,,,118
Водитель руководителя (Транспортный отдел Административно-хозяйственного департамента),АО Bank RBK,1,,0,https://almaty.hh.kz/vacancy/132106832?hhtmFrom=vacancy_search_list,hh.kz,"функциональные обязанности: безопасная перевозка руководителя (и членов семьи/персонала по договоренности). профессиональное, безаварийное управление, соблюдение пдд, выбор оптимальных маршрутов с учетом пробок. поддержание автомобиля в чистоте (мойка, химчистка) и исправности, своевременная заправка, прохождение то и осмотр перед выездом. выполнение личных и рабочих поручений руководителя (доставка документов, поездки по делам). соблюдение строгой конфиденциальности информации. необходимые знания и навыки: соблюдение делового этикета и субординации. спокойствие, терпеливость, стрессоустойчивость. наличие прав категории «в» и безаварийный стаж вождения. условия: медицинская страховка + 2 члена семьи бесплатно (по истечении испытательного срока); субсидирование ипотеки и автокредита при стаже работы в банке от 1 года и выше; фитнес в рассрочку со скидкой до 50% у партнеров (по истечении испытательного срока); реферальная программа за привлечение кандидата (50к или 100к в зависимости от грейда); обучение и развитие за счет банка; корпоративная скидка до 50% на skillbox, geekbrains, skillfactory; праздники, конкурсы и тимбилдинги.",,126
Требуются водители на бетоновоз (миксер),,0,,0,https://www.olx.kz/obyavlenie/rabota/trebuyutsya-voditeli-na-betonovoz-mikser-IDqJt34.html,olx.kz,,,697
Менеджер интернет магазинов,ТОО Aroma Trade (Арома Трейд),1,"до 300 000 ₸ за месяц, на руки",1,https://almaty.hh.kz/vacancy/131771589?hhtmFrom=vacancy_search_list,hh.kz,"обязанности: обработка/ консультация заказов (whatsapp, сайт, kaspi, ozon) оформление заказов и контроль оплат контроль цен, остатков и движение товара (склад, точки, 1с) организация доставки и сопровождение заказов поддержание порядка и учёт товара на складе работа с возвратами и обращениями клиентов по онлайн-заказам и фирменным точками организация проведения акций по разным типам товара обслуживание в пункте выдачи (пвз): выдача интернет-заказов клиентам, приходящим в офис требования: умение работать самостоятельно и в команде, быстрая обучаемость, способность работать в условиях многозадачности, условия: официальное трудоустройство, график работы: 5/2, суббота, воскресенье выходные, режим работ с 9:00 до 18:00, обед с 13:00 до 14:00",,290
Младший бухгалтер,ТОО MG Partners Commercial,1,,0,https://almaty.hh.kz/vacancy/132209430?hhtmFrom=vacancy_search_list,hh.kz,"присоединяйтесь к нашей динамичной команде mg partners , лидера на рынке юридического и бухгалтерского консалтинга более 16 лет ! мы гордимся нашим международным признанием, отраженным в рейтингах iflr 1000 и legal 500 , а также нашими публикациями в сборниках glg и mondaq . наша компания специализируется на оказании услуг по казахстанскому законодательству для корпоративных клиентов, нерезидентов, желающих развивать свой бизнес в республике казахстан. наша глобальная миссия - это стимулирование экономического роста, привлечение иностранных инвестиций и создание благоприятной среды для иностранных предпринимателей и инвесторов. сейчас мы ищем умного и амбициозного младшего бухгалтера с опытом работы на аналогичной позиции, готового присоединиться к нашей команде в городе караганда! немного о нас перед тем, как вы отправите свое резюме. работа в команде mg – это: взаимодействие с интересными клиентами; регулярное саморазвитие и повышение знаний и квалификации; молодой и дружелюбный коллектив; комфортный график работы (будни с 9:00 до 18:00); уютный офис в центре города. о преимущественных задачах: составлять своевременно и правильно первичные учетные документы и передавать первичные документы клиенту; ведение учёта товарных операций (приход/расход). работа с клиентами: оформление накладных эсф. проведение операций импорт-экспорт, выписка снт. работа в программе 1с. отправка и получение корреспонденции; выполнять иные функции по поручению директора. мы будет рады, если в команду присоединится человек: с высшим образованием по специальности экономика, финансы и бухгалтерский учет. если образование по другой специальности, – лицо, прошедшее дополнительное профессиональное образование по спец программам; со знаниями бухгалтерского учета и работы в бухгалтерской программе 1с, а именно: со знанием как принимать к учету первичные документы и регистрировать данные посредством двойной записи, со знанием как отражать в учете денежные операции по банковским счетам, умеющий формировать платежи в онлайн банке, со знанием программы excel, владеющий грамотной устной и письменной речью.",,239
Офис-менеджер,ТОО Amanat Estate,1,от 400 000 до 800 000 ₸ за месяц до вычета налогов,1,https://almaty.hh.kz/vacancy/132222591?hhtmFrom=vacancy_search_list,hh.kz,"в агентство элитной недвижимости ""amanat estate"" требуется офис-менеджер. обязанности : регистрация договоров, учет договоров: ведение деловой переписки с клиентами и партнерами предоставление отчетности руководству контроль исполнения поручений руководителя обеспечение жизнедеятельности офиса прием и обработка входящих звонков, писем и запросов, осуществление исходящих звонков выполняет поручения руководителя организация проведения переговоров с клиентами компании оплата счетов, закуп товаров и услуг, канцтоваров и т.д. требования: владение этикой делового общения, культурой телефонных переговоров отличные презентабельные и коммуникативные навыки презентабельный внешний вид, самостоятельность, внимательность и ответственность грамотная речь, грамотность условия: своевременная оплата труда; от 400 000 до 800 000 тенге работа в комфортном офисе дружный коллектив зарплатный рост режим работы 5/2 с 10.00-19.00 наш инстаграм: @amanat.estate.kz адрес: г. астана, жк millennium park, улица касыма аманжолова, 28, офис 1.",,1
Требуется дизайнер мебели,,0,,0,https://www.olx.kz/obyavlenie/rabota/trebuetsya-dizayner-mebeli-IDqGYzq.html,olx.kz,,,839
Системный администратор,ТОО Центр технической компетенции DEMEU,1,"от 500 000 ₸ за месяц, до вычета налогов",1,https://almaty.hh.kz/vacancy/132125095?hhtmFrom=vacancy_search_list,hh.kz,"вакансия: системный администратор (астана) ищем системного администратора, который обеспечит стабильную работу it-инфраструктуры компании и будет развивать её вместе с нами. 🚀 задачи обеспечение бесперебойной работы серверной и виртуальной инфраструктуры настройка и администрирование серверного оборудования управление виртуализацией (vmware, hyper-v, proxmox) администрирование windows server и linux поддержка active directory, dns, dhcp работа с системами хранения данных (san/nas) настройка и контроль резервного копирования мониторинг систем и обеспечение информационной безопасности 📌 требования опыт работы с серверным оборудованием (dell, hpe, huawei, lenovo) навыки настройки raid, idrac/ilo опыт работы с виртуализацией (vmware, hyper-v или proxmox) знание windows server и linux опыт работы с ad, dns, dhcp понимание принципов работы san/nas опыт настройки backup-решений (veeam, acronis и др.) навыки мониторинга и базовое понимание информационной безопасности 💼 условия формат работы: оффлайн (астана) заработная плата: от 500 000 тенге график: 5/2, 09:00–18:00 возможность профессионального и карьерного роста работа в стабильной и развивающейся компании",,425
Требуется разнорабочий,,0,3 500 тг.,1,https://www.olx.kz/obyavlenie/rabota/trebuetsya-raznorabochiy-IDpKIKK.html,olx.kz,,,739
Диспетчер,ТОО СТОЛИЧНЫЙ ХЛЕБ,1,"230 000 ₸ за месяц, на руки",1,https://almaty.hh.kz/vacancy/132102580?hhtmFrom=vacancy_search_list,hh.kz,,,396
Яндекс таксопарк | Комфорт и Комфорт+ водитель | Работ в такси,,0,,0,https://www.olx.kz/obyavlenie/rabota/yandeks-taksopark-komfort-i-komfort-voditel-rabot-v-taksi-IDqzY6E.html,olx.kz,,,674
Менеджер по продажам,ТОО BLESK.KZ,1,от 350 000 ₸ за месяц на руки,1,https://almaty.hh.kz/vacancy/131806237?hhtmFrom=vacancy_search_list,hh.kz,"о компании мы — официальный дистрибьютор бытовой техники blesk в казахстане и центральной азии. blesk — это качество, гарантия до 3 лет и локальная сервисная сеть по казахстану. обязанности: консультирование клиентов в шоуруме по ассортименту товаров помощь покупателям в выборе техники, мебели или сантехники в зависимости от потребностей презентация товаров, преимуществ, характеристик и актуальных предложений сопровождение клиента на всех этапах продажи оформление заказов и контроль их передачи в дальнейшую обработку работа с кассой и документами, если требуется поддержание порядка, чистоты и привлекательного вида товара в шоуруме контроль наличия ценников, актуальности информации и правильной выкладки участие в приеме товара и проверке его внешнего состояния выполнение плана продаж ведение клиентской базы и работа с повторными покупателями ответы на звонки, сообщения и обращения клиентов соблюдение стандартов сервиса и корпоративной этики требования: опыт работы в оптовых продажах от 2 лет (желательно в сфере бытовой техники / мебели / стройматериалов). умение работать с клиентами. инициативность, ориентация на результат, умение выстраивать долгосрочные отношения. условия: работа с сильным брендом ( blesk ) и официальным дистрибьютором. конкурентный доход: фиксированный оклад + % от продаж. бонусы и премии за выполнение kpi. сильный ассортимент, который легко продавать. поддержка маркетинговыми материалами (каталоги, posm, контент). карьерный рост до руководителя отдела продаж.",,127
