title,company_name,has_company_name,salary,has_salary,url,source,description,label,id
Fullstack-разработчик (Автоматизация бизнес-процессов),АО Kolesa (АО Колеса),1,от 600 000 до 1 100 000 ₸ за месяц на руки,1,https://almaty.hh.kz/vacancy/132184840?hhtmFrom=vacancy_search_list,hh.kz,"kolesa group — международная it-компания, строим классифайды для 12,5 миллионов пользователей. наши продукты — kolesa.kz | krisha.kz | avtoelon.uz — помогают людям и бизнесам продавать, покупать и владеть авто, недвижимостью, товарами и услугами. культура экспериментов, командный дух, технологии, постоянное развитие и желание достичь крутых результатов — отличительные черты kolesa team. о вакансии: работа предстоит с atlassian jira server, scriptrunner, rest-интеграциями и множеством бизнес-идей, которые нужно превращать в работающие бизнес-процессы. ты будешь разрабатывать и улучшать внутренние системы и бизнес-процессы, которые помогают командам эффективнее работать, автоматизировать рутинные задачи и поддерживать стабильность операционных процессов. тебе предстоит: проектирование и разработка бизнес-процессов (atlassian jira server с использованием groovy/java (scriptrunner); поддержка и рефакторинг существующей логики, выявление узких мест и предложение улучшений; автоматизация с использованием скриптов, процедур и интеграций с внешними сервисами через rest api; анализ логов и отладка проблем в работе бизнес-процессов и автоматизации; поддержка документации: создание и актуализация технических описаний и пользовательских инструкций; взаимодействие с другими командами и заказчиками для прояснения требований и совместной работы над улучшениями. мы ждем от тебя: опыт разработки на одном из языков: java / python / go / php / c# / groovy; уверенные знания sql, понимание структуры реляционных бд; понимание клиент-серверной архитектуры и принципов работы rest api; опыт работы с git: работа с ветками и базовыми операциями; умение читать логи и разбираться в причинах ошибок; базовые знания html; умение работать с требованиями: задавать вопросы, уточнять детали и формировать понимание задачи; понимание бизнес-целей и ориентация на результат; готовность работать в алматы (из офиса или гибрид с возможностью работать 2-3 дня в неделю удаленно). будет преимуществом: базовые знания javascript; опыт автоматизации процессов или работы с интеграциями; опыт работы с jira / scriptrunner / groovy; понимание bpmn или опыт описания бизнес-процессов; знания linux; понимать, что ""под капотом"" у продуктов atlassian. что приятного предлагаем: работу в сильной команде, где ценятся взаимопомощь и ориентация на результат; постоянный рост: система грейдирования, индивидуальные планы развития, менторство; тематические мероприятия: квизы, киновечера, family day, тимбилдинги; медицинскую страховку, оплату авиабилетов, фитнеса, образования и многое другое — твой выбор, куда использовать соцпакет; обучение: мы оплачиваем участие в конференциях, тренингах, мастер-классах; корпоративные скидки от наших партнеров; программа релокации для иногородних сотрудников.",,93
Разнорабочий на производство,,0,80 000 тг.,1,https://www.olx.kz/obyavlenie/rabota/raznorabochiy-na-proizvodstvo-IDqLSfg.html,olx.kz,,,544
Главный менеджер Департамента стратегии и корпоративного планирования,Государственный фонд Alatau City Authority,1,от 750 000 ₸ за месяц на руки,1,https://almaty.hh.kz/vacancy/132200574?hhtmFrom=vacancy_search_list,hh.kz,"обязанности: подготовка стратегий, программ развития; формирование целей, задач и системы kpi; методологическое сопровождение стратегического планирования; формирование и мониторинг системы показателей эффективности реализации стратегических документов; разработка и декомпозиция kpi; мониторинг достижения целевых индикаторов; проведение экономического и инвестиционного анализа инвестиционных проектов; подготовка аналитических записок, докладов и управленческих презентаций; формирование обоснованных выводов и предложений; проектное управление стратегическими инициативами; структурирование задач и координация работы подразделений; контроль сроков и результатов реализации стратегических проектов требования: образование высшее образование в области экономики, финансов, государственного управления, стратегического менеджмента, международных отношений. наличие зарубежного образования или степени магистра (mba, mpa, msc) является преимуществом. дополнительная квалификация в области проектного управления (pmi, prince2) приветствуется. профессиональный опыт и компетенции опыт работы не менее 3 лет в сфере стратегического планирования, развития городов, экономического анализа и инвестиционной аналитики. практический опыт разработки стратегий развития, программных документов, kpi и системы показателей эффективности, а также аналитических записок для руководства. желателен опыт работы в международных компаниях, рейтинговых агентствах или консалтинге (big4). цифровые навыки продвинутый уровень владения ms excel, powerpoint (подготовка управленческих презентаций). навыки работы с bi-системами (power bi, tableau) — преимущество. базовые навыки обработки данных (sql, python) — желательно",,90
Требуется в кафе в р-н аэропорта повар-универсал со стажем,,0,,0,https://www.olx.kz/obyavlenie/rabota/trebuetsya-v-kafe-v-r-n-aeroporta-povar-universal-so-stazhem-IDqoSzL.html,olx.kz,,,573
Таксопарк Яндекс | Яндекс такси для водителей | Подключение водителей,,0,,0,https://www.olx.kz/obyavlenie/rabota/taksopark-yandeks-yandeks-taksi-dlya-voditeley-podklyuchenie-voditeley-IDqyF23.html,olx.kz,,,778
Требуется автомойщик,,0,,0,https://www.olx.kz/obyavlenie/rabota/trebuetsya-avtomoyschik-IDqHRiz.html,olx.kz,,,789
Требуется разнарабочие на стройку,,0,,0,https://www.olx.kz/obyavlenie/rabota/trebuetsya-raznarabochie-na-stroyku-IDmrPyo.html,olx.kz,,,741
Требуется работник,,0,,0,https://www.olx.kz/obyavlenie/rabota/trebuetsya-rabotnik-IDpTbyi.html,olx.kz,,,526
Менеджер пункта выдачи заказов (ПВЗ),ТОО Jana Post,1,от 270 000 до 300 000 ₸ за месяц на руки,1,https://almaty.hh.kz/vacancy/132184658?hhtmFrom=vacancy_search_list,hh.kz,,,95
Разнорабочий,ТОО Startaff,1,до 600 000 ₸ за месяц на руки,1,https://almaty.hh.kz/vacancy/132224797?hhtmFrom=vacancy_search_list,hh.kz,"условия вакансии на пищевое производство вахтой в нижегородской области (г.павлово): ✅ ставка в дневную смену - от 300 руб.💰/час ✅ ставка в ночную смену - от 320 руб.💰/час ✅ 90 cмeн - минимальный срок вахты предоставляем от компании: - пpoживаниe со всеми условиями в квартирах; - комплексные обеды; - билeты от компании до объекта; - легализация; - спец одежду для комфортной работы; - мед комиссию; - официальное трудоустройство по тк рф; - система еженедельных авансирований; обязанности на производстве: - обработка птицы на конвейере; - фасовка и упаковка; - обвалка сырья; - набор продукции; - навеска, погрузка, разгрузка, выгрузка, сортировка продукции; - обвалка тушек птицы, упаковка, перемещение продукции;",,12
Таксопарк Яндекс | Яндекс такси для водителей | Подключение водителей,,0,,0,https://www.olx.kz/obyavlenie/rabota/taksopark-yandeks-yandeks-taksi-dlya-voditeley-podklyuchenie-voditeley-IDqyF4s.html,olx.kz,,,772
Кассир,ИП Птушко Максим Константинович,1,15 000 ₸ за смену на руки,1,https://almaty.hh.kz/vacancy/131839276?hhtmFrom=vacancy_search_list,hh.kz,"кассир (bazaar) зарплата: 15 000 ₸ за смену график: 3/4 (3 дня в неделю, иногда 4) время работы: 10:00–22:00 мы ищем кассира в команду bazaar. нужны быстрые, внимательные и дружелюбные сотрудники, которые любят порядок в цифрах и умеют держать темп в потоке. обязанности работа на кассе: обслуживание покупателей, проведение оплат (наличные/карта/переводы). корректное оформление продаж в системе. проверка цен и соответствия товара в чеке. информирование покупателей о бонусной системе/акциях, помощь с оформлением бонусной карты. соблюдение кассовой дисциплины и стандартов обслуживания. взаимодействие с администратором по спорным ситуациям/возвратам (по регламенту). требования внимательность и ответственность (касса ошибок не любит). вежливое общение и умение работать с потоком. опыт кассиром будет плюсом, но можем обучить. мы предлагаем стабильную оплату: 15 000 ₸ за смену понятный график: 3 дня в неделю обучение и поддержку администратора перспективу роста и систему мотивации (в перспективе)",,44
Стажер-разработчик,ТОО Prime Source,1,от 200 000 до 250 000 ₸ за месяц на руки,1,https://almaty.hh.kz/vacancy/131896635?hhtmFrom=vacancy_search_list,hh.kz,"обязанности: разработка, развитие и поддержка аналитической системы требования: знание основ программирования знания любого языка программирования (javascript, php, python, c#, java, c, c++ и др) писать код, понимать основные принципы разработки по быть знакомым с алгоритмами и типами переменных преимуществом будет: образование техническое, в области математики, физики базовые знания sql наличие собственных проектов условия: оплата на стажировке 200 000 тенге оплата после стажировки 250 000 тенге",,43
QA инженер (Middle),АО Alatau City Bank,1,,0,https://almaty.hh.kz/vacancy/132238203?hhtmFrom=vacancy_search_list,hh.kz,"просим обратить внимание на адрес работы и на офисный формат работы 5/2! критически важен опыт работы в тестировании мобильных приложений! обязанности: специалист для помощи в решении стратегических задач по развитию процессов разработки и тестирования. участие в тестировании доработок продуктовыми командами внедрение практик и подходов согласно роудмапа компании. требования: agile mindset и опыт работы в agile среде (scrum, kanban). strong hands-on опыт в веб и мобильном тестировании (2 года+). опыт тестирования приложений с микросервисной архитектурой. 3+ лет опыта тестирования api (postman, swagger). мобильное тестирование с помощью симуляторов и эмуляторов. умение работать с логами в kibana опыт тестирования баз данных (postgresql, oracle database) и применения sql операторов на практике. самоорганизованность, проактивность уверенное владение git. дополнительно будет : умение строить sql-запросы, postman, swagger опыт работы в scram критическое мышление и внимание к деталям условия: формат работы - офис 5/2 в алматы (казахстан) - проспект аль-фараби 36в (бц иле) корпоративные скидки на фитнес; бесплатная подписка на онлайн библитеку «аlpina digital»; приятная рабочая атмосфера в современном офисе в деловой части города; возможность строить карьеру в одном из крупнейших банков казахстана.",,330
Менеджер цифровых проектов (Digital Project Manager),ТОО PREMIUM AUTO ALMATY (АВТОЦЕНТР-БАВАРИЯ),1,от 850 000 ₸ за месяц до вычета налогов,1,https://almaty.hh.kz/vacancy/132059118?hhtmFrom=vacancy_search_list,hh.kz,"обязанности: 1) управление проектами по разработке диджитал решений для оптимизации внутренних процессов, а также для удовлетворения потребностей клиентов. координация с отделами компании (маркетинг, продажи, it, сервисное обслуживание, финансовый департамент) разработка технических заданий для подрядчиков на основании выявленных потребностей, постановка целей и задач разработка платформ и приложений, интеграция решений с сайтами компании совместно с разработчиками контроль и проверка исполнения поставленных задач, включая координацию работы отделов компании, а также подрядчиков. 2) администрирование и развитие сайтов компании проведение анализа работы сайта, определение проблемных зон, выявление решений совместно с разработчиками, в том числе совместно с технической поддержкой штаб-квартиры в германии обновление сайта, контента по запросу команды внедрение новых инструментов на сайтах компании совместно с разработчиками координация работы seo совместно с техподдержкой сайтов 3) внедрение и координация работы систем для анализа бизнес-показателей, маркетинговой эффективности. подготовка отчетов и анализ данных. 4) коммуникация со штаб-квартирой, предоставление отчетов по диджитал проектам, участие в тренингах и получение сертификации. требования: навыки тайм-менеджмента, многозадачности, управления процессами. навыки коммуникации и умение работать в команде целеустремленность и инициативность, желание расти и развиваться умение анализировать большие объемы данных, делать выводы и давать рекомендации опыт работы: образование – высшее желателен опыт запуска интернет-проектов и диджитал решений для бизнеса понимание работы crm, опыт работы с crm желателен понимание азов маркетинга, работы инструментов диджитал рекламы знание основ web/mobile-разработки (базовые понятия, понимание этапов и стандартов разработки, лучшие практики) базовое понимание принципов ux/ui дизайна, стандартов разработки структуры и дизайна интерфейсов (web/mobile) знание английского языка (upper intermediate и выше) желателен опыт в программировании",,168
"Универсал парикмахер,женский,мужской в салон красоты нужен",,0,,0,https://www.olx.kz/obyavlenie/rabota/universal-parikmaher-zhenskiy-muzhskoy-v-salon-krasoty-nuzhen-IDoVbuG.html,olx.kz,,,742
Требуются кассиры,,0,,0,https://www.olx.kz/obyavlenie/rabota/trebuyutsya-kassiry-IDm9Gib.html,olx.kz,,,515
Требуются разнорабочие,,0,,0,https://www.olx.kz/obyavlenie/rabota/trebuyutsya-raznorabochie-IDqJs8Z.html,olx.kz,,,797
Требуется массажист,,0,50 000 тг.,1,https://www.olx.kz/obyavlenie/rabota/trebuetsya-massazhist-IDqElto.html,olx.kz,,,454
Начальник IT-отдела,ТОО МолКом-Павлодар,1,,0,https://almaty.hh.kz/vacancy/132155674?hhtmFrom=vacancy_search_list,hh.kz,"обязанности: руководство работой ит-службы и распределение задач. участие в разработке нового функционала 1с упп, бк обеспечение бесперебойной работы ит-инфраструктуры (серверы, сети, связь, по). планирование развития и модернизации ит-систем. контроль обработки и защиты данных, информационной безопасности. организация обслуживания и ремонта техники. взаимодействие с подрядчиками и поставщиками. формирование и контроль ит-бюджета. требования: опыт работы разработчиком 1с не менее 3х лет условия: официальное трудоустройство бесплатное питание развозка спецодежда 13ая заработная плата (по итогам года)",,179
Менеджер по продажам В2b,,0,8 000 тг.,1,https://www.olx.kz/obyavlenie/rabota/menedzher-po-prodazham-v2b-IDqFGaM.html,olx.kz,,,559
Вахта Лемана про Россия,,0,,0,https://www.olx.kz/obyavlenie/rabota/vahta-lemana-pro-rossiya-IDqHtmD.html,olx.kz,,,568
