title,company_name,has_company_name,salary,has_salary,url,source,description,label,id
Заместитель Директора сервисной компании,ТОО ORDA INVEST,1,,0,https://almaty.hh.kz/vacancy/132226856?hhtmFrom=vacancy_search_list,hh.kz,"в управляющую компанию требуется заместитель директора компании. обязанности: • планирование, организация, управление и контроль деятельности управляющей компании. • обеспечение бесперебойной, безопасной и качественной эксплуатации мжк, коммерческой площади, и придомовой территории, проведение их регулярных осмотров, фиксирование недостатков и организация рабочего процесса устранения недостатков. • краткосрочное и долгосрочное планирование необходимых работ текущего и капитального характера по эксплуатации мжк, отслеживание выполнения планов, формирование отчетов. разработка и внедрение необходимых для этого регламентов, графиков, конкурсов. • проведение тендеров на выбор подрядных и обслуживающих организаций. • работа с собственниками, нанимателями, арендаторами помещений и общедомового имущества по всем вопросам деятельности управляющей компании, контроль за выполнением поступающих от них заявок, претензий. • представление интересов управляющей компании в органах государственного управления и контроля по вопросам обслуживания дома. участие в проверках контролирующих органов. • разработка тз на проектирование новых объектов (сервисная часть тз). • участие в приемке объектов в эксплуатацию. • контроль за своевременным погашением задолженности за предоставленные услуги; требования: • опыт работы на управленческой должности не менее 5 лет (опыт работы в сфере жкх, ук, проперти приветствуется); • высшее образование (желательно техническое, юридическое или экономическое); • инициативность, ответственность, организаторские способности, самостоятельность в принятии решений, добросовестность, коммуникативные навыки, стрессоустойчивость; • уверенный пользователь пк.",,20
Педагог по живописи,ИП Детский клуб Династия,1,от 5 000 до 7 000 ₸ за час до вычета налогов,1,https://almaty.hh.kz/vacancy/132220878?hhtmFrom=vacancy_search_list,hh.kz,"обязанности: проведение групповых занятий по живописи для детей 5-10 лет, объяснение художественных техник в доступной и игровой форме, поддержание интереса детей к творческому процессу, создание доброжелательной атмосферы на уроке, подготовка работ детей к выставкам, организация их участия. требования: художественное образование, педагогическое/психологическое образование (или курсы по работе с детьми) будут большим плюсом, опыт работы с детьми от 5 лет умение управлять вниманием группы, опыт работы с группами 10-12 детей доброжелательность к детям, терпение, эмоциональная устойчивость - обязательны. условия: занятость:от 4 часов в неделю (график обсуждается индивидуально) есть два филиала: жк life town и жк гаухартас - при отклике укажите интересующие вас филиал.",,173
Работа Грузчик на Склад,,0,,0,https://www.olx.kz/list/user/1m6f5U/,olx.kz,,,690
Водитель,Kaspi.kz,1,,0,https://almaty.hh.kz/vacancy/132102395?hhtmFrom=vacancy_search_list,hh.kz,"обязанности: нести ответственность за сохранность перевозимых ценностей; следить за состоянием автомобиля; оформлять путевые листы. требования: знания правил дорожного движения и технической эксплуатации транспортного средства; умение объективно оценивать ситуацию и быстро принимать правильные решения; умение выполнять взятые на себя обязательства; средне специальное/высшее образование/среднее; условия: работа в лучшем финтехе; коллектив профессионалов, с которым интересно и надежно работать; стабильная заработная плата. ключевые навыки знание устройства автомобиля автомобильные перевозки",,313
Фельдшер,SabTrade,1,"200 000 ₸ за месяц, на руки",1,https://almaty.hh.kz/vacancy/132161097?hhtmFrom=vacancy_search_list,hh.kz,"обязанности: проведение водителям предрейсовых/пострейсовых медицинских осмотров (на наличие выявления у водителей автотранспортных средств признаков употребления алкоголя, наркотиков, запрещенных лекарственных препаратов, остаточных явлений алкогольной интоксикации (похмельного синдрома), утомления); оказание первой доврачебной помощи при возникновении травмы или другой ситуации, связанной с резким ухудшением здоровья работника; обеспечение своевременного и качественного оформления документации в соответствии с установленными правилами; ведение контроля за наличием и соблюдением сроков действия санитарных книжек работников и сроков проведения ежегодных проф. осмотров. требования: среднее-специальное или высшее медицинское образование; опыт работы от 2-х лет и более на аналогичной должности; наличие сертификатов ""работа с алкотестером"", ""фельдшер"". условия: график работы: 6/1, с 05:00 до 11:00 часов; стабильная заработная плата без задержек; оформление в соответствии с трудовым кодексом рк; возможности карьерного роста. изначально адрес рабочего места - ул.немировича-данченко, 24, далее планируется переезд на ул. бережинского, 42, ​с. аскара токпанова, илийский район, территория промзоны.",,391
Требуется грузчик (з/п от 170.000 тг. График 2 через 2),,0,,0,https://www.olx.kz/obyavlenie/rabota/trebuetsya-gruzchik-z-p-ot-170-000-tg-grafik-2-cherez-2-IDmXYGF.html,olx.kz,,,791
Водитель,ТОО LF Group,1,300 000 ₸ за месяц на руки,1,https://almaty.hh.kz/vacancy/132230311?hhtmFrom=vacancy_search_list,hh.kz,"обязанности безопасное и своевременное управление транспортным средством соблюдение правил дорожного движения и внутренних инструкций компании поддержание технического состояния автомобиля требования опыт работы водителем от 1 года наличие водительского удостоверения соответствующей категории знание маршрутов и правил дорожного движения готовность работать по графику 6/1 условия стабильная заработная плата 300000 график работы 6/1 работа в комфортных условиях машина ,бензин, мойка 1 раз в неделю все за счет организаций бесплатное питание 2 раза в день",,13
Продавец-кассир,ИП Масыгутова Ж.М.,1,"от 10 000 до 12 000 ₸ за смену, на руки",1,https://almaty.hh.kz/vacancy/132050517?hhtmFrom=vacancy_search_list,hh.kz,"обязанности: обслуживание на кассе приготовление напитков бабл ти учет и ревизия поддержание чистоты на рабочем месте требования: ответственность, вежливость, доброжелательность опыт приветствуется в сфере приготовления напитков готовность к обучению условия: стабильная зарплата комфортные условия работы",,408
Водитель-экспедитор с личным автотранспортом,ТОО Golden Way Trading,1,"365 000 ₸ за месяц, на руки",1,https://almaty.hh.kz/vacancy/132155006?hhtmFrom=vacancy_search_list,hh.kz,"водитель-экспедитор с личным авто обязанности: выполнение погрузочно-разгрузочных работ; развозка продукции по магазинам требования: быть ответственным и пунктуальным; личный автотранспорт (не тент), условия: режим работы - гибкий график; зарплата+гсм график работы 5/2 (суббота, воскресенье выходной); официальное трудоустройство.",,409
Водитель,ИП Антоненко И. В,1,"от 350 000 до 600 000 ₸ за месяц, на руки",1,https://almaty.hh.kz/vacancy/132009361?hhtmFrom=vacancy_search_list,hh.kz,обязанности: доставка продуктов питания по городу на грузовых автомобилях материальная ответственность подсчет и сдача наличных средств с доставки согласно по купюрному листу сохранность автомобиля в чистоте и порядке требования: знание города и подъездных путей к магазинам пунктуальность оперативность ответственность наличие водительских прав категории вс условия: официальное трудоустройство рабочий график 8.00-17.00,,306
Инженер по охране труда и технике безопасности,ТОО Kazakh Investment and Construction Group,1,,0,https://almaty.hh.kz/vacancy/132237715?hhtmFrom=vacancy_search_list,hh.kz,,,355
Куратор студентов,ТОО ITSTEP Academy Astana,1,от 300 000 до 450 000 ₸ за месяц на руки,1,https://almaty.hh.kz/vacancy/132233644?hhtmFrom=vacancy_search_list,hh.kz,"компьютерная академия шаг - крупнейшее учебное заведение в сфере информационных технологий с 1999 года. мы специализируемся в it-образовании для взрослых и детей. в казахстане шаг осуществляет свою деятельность в алматы, астане, караганде, атырау, шымкенте, актобе, костанае, актау, уральске, усть-каменогорске, темиртау. мы ищем - куратора студентов мы ищем системного и сильного организатора, который возьмёт под контроль учебный процесс и обеспечит высокий уровень обучения студентов. ваша ключевая задача обеспечить стабильный, понятный и качественный учебный процесс, в котором студенты доходят до результата и остаются довольны обучением. если вы: умеете выстраивать и наводить порядок в процессах легко находите общий язык с людьми умеете доводить задачи до результата — эта позиция для вас. обязанности: ведение учебных групп от старта до выпуска проведение вводных встреч и сопровождение студентов контроль посещаемости, вовлеченности и прогресса помощь в решении организационных вопросов формирование позитивного опыта обучения формирование учебных групп составление и контроль расписания координация всех участников процесса (студенты, преподаватели, администрация) обеспечение бесперебойной работы учебного отдела адаптация новых преподавателей контроль качества проведения занятий поддержание стандартов обучения мы ожидаем от вас опыт управления процессами / в образовании / сервисе сильные коммуникативные навыки организованность и системное мышление умение работать в многозадачности ответственность за результат мы предлагаем 💰 доход: оклад 250 000 тг + kpi 📅 график: 5/2, с 10:00 до 19:00 (плавающие выходные) 📄 официальное трудоустройство по тк рк 🏢 современный офис в центре города 🤝 поддержку команды и понятные процессы 📈 возможность карьерного роста",,26
Идет набор на вахту,,0,,0,https://www.olx.kz/obyavlenie/rabota/idet-nabor-na-vahtu-IDqzoP4.html,olx.kz,,,629
Менеджер отдела управления маршрутами,АО Авиакомпания SCAT,1,от 350 000 до 400 000 ₸ за месяц до вычета налогов,1,https://almaty.hh.kz/vacancy/131645420?hhtmFrom=vacancy_search_list,hh.kz,"обязанности: управление доходностью рейсов за счёт квотирования классов бронирования; контроль коммерческой загрузки пассажирских рейсов на закреплённых маршрутах; мониторинг ценовой политики и расписания конкурентов; анализ рыночной ситуации и участие в формировании тарифной политики; разработка и применение сезонных правил в системе управления доходами; работа с внутренними системами управления доходами и их оптимизация; обеспечение корректной работы внедрённых программных продуктов; взаимодействие со смежными подразделениями компании; выполнение поручений руководства и участие в решении операционных задач отдела. требования: — высшее образование (экономика, математика, транспорт, авиация будет преимуществом); — аналитическое мышление и умение работать с большим объёмом данных; — опыт работы в авиации / revenue management / аналитике - приветствуется; — уверенное владение excel и аналитическими инструментами; — внимательность к деталям и ответственность; — умение работать в команде и в условиях многозадачности; знание казахского и английского языков; уверенное владение excel. условия: оформление по трудовому договору; — возможен сменный график; — обучение 10-14 дней (без опллаты); — испытательный срок - 3 месяца; — после прохождения испытательного срока - дополнительная стимулирующая надбавка; — скидки на авиаперелеты при достижении установленного трудового стажа.",,170
Требуется парикмахер,,0,,0,https://www.olx.kz/obyavlenie/rabota/trebuetsya-parikmaher-IDqI5Zd.html,olx.kz,,,535
Разработчик Front-End в Проектный офис,АО «Компания по страхованию жизни «Nomad Life»,1,,0,https://almaty.hh.kz/vacancy/132227606?hhtmFrom=vacancy_search_list,hh.kz,"хотите стать частью команды, которая меняет будущее страхования жизни? присоединяйтесь к nomad life и откройте для себя новые возможности! наши условия: достойная оплата труда: конкурентоспособная заработная плата и ежеквартальные бонусы, новогодний корпоратив за рубежом, возможность выбора гибкого графика работы. стабильность и надежность: работаем на рынке более 15 лет и имеем устойчивую финансовую позицию. профессиональный рост: предоставляем возможности для обучения и развития, а также карьерный рост для амбициозных сотрудников. социальный пакет: медстраховка, подарки к праздникам и дополнительные бонусы и льготы. дружный коллектив: ценим каждого члена нашей команды и создаем атмосферу взаимопомощи и поддержки. причина возникновения вакансии: участие в проекте разработки crm-системы необходимое образование, специальность: высшее образование в области информационных технологий. опыт в финтехе / страховании / банках. обязанности: разработка spa-интерфейсов на vue 3 + nuxt 4 + typescript работа с формами, валидацией, локализацией (ru/kz) кастомизация ui-кита (primevue) и вёрстка на tailwind интеграция с rest api, авторизацией, оплатой и подписанием участие в код-ревью и развитии общего core-слоя требования: коммерческий опыт с vue 3 (composition api) — от [2/3] лет. уверенный typescript. опыт с nuxt 3/4. pinia, vuelidate (или аналоги), axios. tailwind css, опыт кастомизации ui-китов уровня primevue / vuetify / element plus. понимание работы с jwt и spa-режимом. git, опыт работы в команде. будет плюсом работа с эцп (ncalayer), микрофронтами, iframe-интеграциями. знание казахстанской специфики (иин/бин, e-gov) стек : nuxt 4 · vue 3 · typescript · pinia · primevue · tailwind · vuelidate · axios · i18n · docker · gitlab ci условия: график работы с 9:00 до 18:00 профессиональный коллектив возможность работать над интересными проектами комфортный офис в центре города работа в сильной команде, где ценят инициативу, договоренности и эффективность знания языков: казахский язык",,39
Управляющий в компьютерный клуб,ИП XO GAME CLUB,1,от 400 000 ₸ за месяц на руки,1,https://almaty.hh.kz/vacancy/132046507?hhtmFrom=vacancy_search_list,hh.kz,"управляющий в премиальный компьютерный клуб обязанности: • полное управление клубом и операционной деятельностью • контроль персонала (администраторы, тех. персонал) • обеспечение высокого уровня сервиса и клиентского опыта • работа с выручкой, отчетностью и кассой • контроль технического состояния оборудования • организация акций, развитие клуба и привлечение клиентов требования: • обязательный опыт управления компьютерным клубом • любой пол • обязательное знание senet и iiko • ответственность, лидерские качества • умение работать с персоналом и клиентами условия: • работа в премиальном компьютерном клубе • конкурентная заработная плата (обсуждается) • дружная команда и современная атмосфера • возможность роста и развития",,176
